{
  "agent_id_sha256": "sha256:f0b811e84b0eb55f5577e3ddfc38d7dd289d4ca0c79c19bff7fc3e43d84d080c",
  "bridge_protocol": "sdk.v1",
  "entity_count": null,
  "environment_allow_list_digest": "sha256:df48e445407ea450138c07d526a73151c7f38562b49679cf7a25e361dc9d82b9",
  "fact_count": null,
  "fixture_id": "relations-timestamps",
  "isolation": {
    "custom_tool_count": 0,
    "cwd_cursor_entry_count": 0,
    "cwd_empty": true,
    "cwd_has_git": false,
    "environment_allow_list": [
      "PATH",
      "HOME",
      "TMPDIR",
      "TMP",
      "TEMP",
      "XDG_CONFIG_HOME",
      "XDG_DATA_HOME",
      "XDG_CACHE_HOME",
      "XDG_STATE_HOME",
      "XDG_RUNTIME_DIR",
      "LANG",
      "LC_ALL",
      "LC_CTYPE",
      "SSL_CERT_FILE",
      "SSL_CERT_DIR",
      "REQUESTS_CA_BUNDLE",
      "CURL_CA_BUNDLE",
      "CURSOR_API_KEY"
    ],
    "home_cursor_entry_count": 0,
    "hook_count": 0,
    "mcp_count": 0,
    "prior_message_count": 0,
    "prior_store_entry_count": 0,
    "setting_sources": "OMITTED",
    "subagent_count": 0,
    "tool_count": 0,
    "unclassified_cursor_entry_count": 0
  },
  "isolation_digest": "sha256:af5186eb990b770ebad3dd6aeb8c28ec6be521eda4fb15de7fd29722ad517e77",
  "json_valid": true,
  "key_set_digest": null,
  "label": "sdk-upstream-batch-timestamps",
  "latency_ms": 3264,
  "model": "composer-2.5",
  "ordinal": 4,
  "prompt_bytes": 2134,
  "prompt_chars": 2134,
  "prompt_class": "upstream_batch_timestamps",
  "prompt_sha256": "sha256:0b7c3ffc12efb4610da3533da2aea2d16962248fd3df97befaa7ed760424a1d8",
  "route_option_digest": "sha256:12740bacf70775c030085793965e3f16c1d97a0900bd5c127ed3935bd41e1aee",
  "schema_bytes": 837,
  "schema_sha256": "sha256:fd18e28319c09b4930749ee3a1545d0766db660af0d3101bd80d5c254741f12e",
  "schema_version": "newsroom.graphiti-sdk-no-tool-calibration.v1",
  "sdk_version": "1.0.28",
  "semantic_failure_codes": [],
  "semantic_fixture_result": "PASS",
  "status": "finished",
  "stream_message_classes": [],
  "tool_call_count": 0,
  "usage": {
    "cached_read_tokens": 416,
    "cached_write_tokens": 0,
    "input_tokens": 3984,
    "output_tokens": 378,
    "reasoning_tokens": null,
    "total_tokens": 4778,
    "usage_basis": "PROVIDER_REPORTED"
  },
  "usage_status": "PROVIDER_REPORTED",
  "validator_version": "newsroom.graphiti-sdk-no-tool-validator.v1"
}
