{
  "agent_id_sha256": "sha256:20a15d7644d1f52379be6e38ea65ae09dd0c8957bb6217b0aac32fa245f35f24",
  "bridge_protocol": "sdk.v1",
  "entity_count": null,
  "environment_allow_list_digest": "sha256:df48e445407ea450138c07d526a73151c7f38562b49679cf7a25e361dc9d82b9",
  "fact_count": null,
  "fixture_id": "zero-result-368",
  "isolation": {
    "custom_tool_count": 0,
    "cwd_cursor_entry_count": 0,
    "cwd_empty": true,
    "cwd_has_git": false,
    "environment_allow_list": [
      "PATH",
      "HOME",
      "TMPDIR",
      "TMP",
      "TEMP",
      "XDG_CONFIG_HOME",
      "XDG_DATA_HOME",
      "XDG_CACHE_HOME",
      "XDG_STATE_HOME",
      "XDG_RUNTIME_DIR",
      "LANG",
      "LC_ALL",
      "LC_CTYPE",
      "SSL_CERT_FILE",
      "SSL_CERT_DIR",
      "REQUESTS_CA_BUNDLE",
      "CURL_CA_BUNDLE",
      "CURSOR_API_KEY"
    ],
    "home_cursor_entry_count": 0,
    "hook_count": 0,
    "mcp_count": 0,
    "prior_message_count": 0,
    "prior_store_entry_count": 0,
    "setting_sources": "OMITTED",
    "subagent_count": 0,
    "tool_count": 0,
    "unclassified_cursor_entry_count": 0
  },
  "isolation_digest": "sha256:af5186eb990b770ebad3dd6aeb8c28ec6be521eda4fb15de7fd29722ad517e77",
  "json_valid": true,
  "key_set_digest": null,
  "label": "sdk-compact-temporal-zero",
  "latency_ms": 17978,
  "model": "composer-2.5",
  "ordinal": 5,
  "prompt_bytes": 1871,
  "prompt_chars": 1871,
  "prompt_class": "compact_combined_temporal",
  "prompt_sha256": "sha256:2cf8e096ebec5b213107bbef14e2edd64f682d60d72b8186ec39a3bcb227d2d8",
  "route_option_digest": "sha256:12740bacf70775c030085793965e3f16c1d97a0900bd5c127ed3935bd41e1aee",
  "schema_bytes": 823,
  "schema_sha256": "sha256:7e39987fffe589d94c8b3dcf6416f538b5ed31883389bc67774826684fdccd16",
  "schema_version": "newsroom.graphiti-sdk-no-tool-calibration.v1",
  "sdk_version": "1.0.28",
  "semantic_failure_codes": [
    "UNCLASSIFIED_RETAINED_FAILURE"
  ],
  "semantic_fixture_result": "FAIL",
  "status": "finished",
  "stream_message_classes": [],
  "tool_call_count": 0,
  "usage": {
    "cached_read_tokens": 9408,
    "cached_write_tokens": 0,
    "input_tokens": 17356,
    "output_tokens": 2558,
    "reasoning_tokens": null,
    "total_tokens": 29322,
    "usage_basis": "PROVIDER_REPORTED"
  },
  "usage_status": "PROVIDER_REPORTED",
  "validator_version": "newsroom.graphiti-sdk-no-tool-validator.v1"
}
